<?xml version="1.0" encoding="UTF-8"?>
<!DOCTYPE arbol SYSTEM "arbol.dtd">
<arbol>
  <lugares>
    <lugar nombre="Valencia" pais="España" />
    <lugar nombre="Gandía" pais="España" />
    <lugar nombre="Marsella" pais="Francia" />
  </lugares>
  <personas>
    <persona>
      <nombre>Pedro Ramírez Dupont</nombre>
      <padre>Juan Ramírez Amigo</padre>
      <madre>Jeanne Dupont</madre>
      <nacimiento lugar="Valencia" fecha="1942-07-14" />
    </persona>
    <persona>
      <nombre>Juan Ramírez Amigo</nombre>
      <nacimiento lugar="Gandía" fecha="1918-11-19" />
    </persona>
    <persona>
      <nombre>Jeanne Dupont</nombre>
      <nacimiento lugar="Marsella" />
    </persona>
  </personas>
</arbol>